### ISSUE TITLE
IPv6 routing and forwarding

### ISSUE THREAD

**Issue by Byggvir** [freifunk-voreifel/supernode-install#12]
Ein Ping über IPv6 erreicht den Zielhost. Der Router 2a03:2260::5 (Freifunk Rheinland) findet jedoch keinen Rückweg.

```
19:18:15.857195 IP6 2a03:2260:301a:1500:d4f6:11d8:abc0:de94 > 2a01:238:4216:400:2719:9f12:f159:ba3f: ICMP6, echo request, seq 214, length 64
19:18:15.857255 IP6 2a01:238:4216:400:2719:9f12:f159:ba3f > 2a03:2260:301a:1500:d4f6:11d8:abc0:de94: ICMP6, echo reply, seq 214, length 64
19:18:15.875204 IP6 2a03:2260::5 > 2a01:238:4216:400:2719:9f12:f159:ba3f: ICMP6, destination unreachable, unreachable route 2a03:2260:301a:1500:d4f6:11d8:abc0:de94, length 112
```

**Comment by Byggvir** [comment]
Unter birdc6 habe ich jetzt folgende Fehlermeldung gesehen.
```
root@voreifel1:~# birdc6
BIRD 1.6.6 ready.
bird> show protocols 
name     proto    table    state  since       info
direct1  Direct   master   up     23:16:03    
kernel1  Kernel   master   up     23:16:03    
device1  Device   master   up     23:16:03    
gre_ber_a BGP      master   start  23:20:26    Idle          Received: Hold timer expired
gre_ber_b BGP      master   start  23:16:03    OpenConfirm   
gre_dus_a BGP      master   start  23:19:43    Active        Received: Hold timer expired
gre_dus_b BGP      master   start  23:16:03    Connect       
gre_fra_a BGP      master   start  23:16:03    OpenConfirm   
gre_fra_b BGP      master   start  23:20:07    Idle          Received: Hold timer expired
```
Damit ist klar, dass das Routing und Forwarding nicht funktionieren kann. Fragt sich nur, auf welcher Seite das Problem liegt.

Die beiden bird6 lassen verbinden sich untereinander ohne Probleme.

**Comment by Byggvir** [comment]
Mit dem Commit ccdf16662c87824f4d2602346204f16965923a8e löst sich zumindest das Verbindungsproblem. Bird6 verschickte die Pakete mit einem HOP=1. Durch einfügen von **multihop 64** im template bgp_uplink lässt sich das verbindungsproblem lösen.

Möglicherweise dauert es eine Weile, bis sich die neuen Routen verbreitet haben, den der FFRL Router findet noch keinen Rückweg.
