### ISSUE TITLE
IPv4 routing

### ISSUE THREAD

**Issue by Byggvir** [freifunk-voreifel/supernode-install#11]
Ein Ping von einem Client zu einer IPv4 Adresse (ping -4 byggvir.de) geht über den Supernode mit NAT über die GRE Tunnel zum Ziel und wird von dort beantwortet. 

```
14:27:03.895338 IP 185.66.193.126 > 85.214.133.14: ICMP echo request, id 18228, seq 553, length 64
14:27:03.895374 IP 85.214.133.14 > 185.66.193.126: ICMP echo reply, id 18228, seq 553, length 64
```
Das Antwortpaket kommt auf dem Supernode wieder über den GRE-Tunnel an. 
```
14:31:40.366608 IP 185.66.193.126 > 85.214.133.14: ICMP echo request, id 18228, seq 823, length 64
14:31:40.402837 IP 85.214.133.14 > 185.66.193.126: ICMP echo reply, id 18228, seq 823, length 64
14:31:40.402849 IP 85.214.133.14 > 10.152.121.2: ICMP echo reply, id 18228, seq 823, length 64
```
Das Antwortpaket wird jedoch nicht über das BAT Interface zurück an den Client geschickt.

```
14:33:05.358748 IP 10.152.121.2 > 85.214.133.14: ICMP echo request, id 18228, seq 906, length 64
14:33:06.382346 IP 10.152.121.2 > 85.214.133.14: ICMP echo request, id 18228, seq 907, length 64
14:33:07.406781 IP 10.152.121.2 > 85.214.133.14: ICMP echo request, id 18228, seq 908, length 64

```

**Comment by Byggvir** [comment]
Der Fehler lag in den IP rules und die Umleitung der Paket vom GRE-Tunnl in die Table 42.

Der folgende Eintrag  ist falsch, er sendet die Paket wieder "zurück" in den GRE-Tunnel.

```
2000:   from all iif gre_ber_a lookup ffrl
```

Im Template muss folgender Eintrag GRE-Tunnel gelöscht werden.

```
[RoutingPolicyRule]
Table=42
IncomingInterface={{ gre[item.0].dev }}
Priority=2000

```

Die eingehenden Pakete dürfen nicht markiert werden.
Im Template für ferm.conf ist folgender Eintrag falsch:

```
            interface {{ gre_tunnel_prefix }}+ {
                MARK set-mark 4;
            }
```

**Comment by Byggvir** [comment]
Closed with commit 1bed408c9f96021fe14e69af2bd8081cb1c0d9c2
